{
  "$schema": "http://json-schema.org/schema",
  "type": "object",
  "title": "Product schema",
  "description": "A product representation",
  "required":false,
  "properties": {
    "id": {
      "type": "string",
      "title": "Id",
      "description": "The id of the product",
      "minLength": 36,
      "maxLength": 36,
      "required": false
    },
    "name": {
      "type": "string",
      "title": "Name",
      "description": "The name of the product",
      "required": true
    },
    "price": {
      "type": "number",
      "title": "Price",
      "description": "The price of the product",
      "required": true
    },
    "weight": {
      "type": "integer",
      "title": "Weight",
      "description": "The weight of the product",
      "required": true
    }
  }
}