[
  {
    "id": "705c2c6b-9261-4248-94ee-787584386a3a",
    "name": "Tea Cosy",
    "price": 5.99,
    "weight": 100
  },
  {
    "id": "ed1116bc-7c7d-4836-9675-2f4aaff224d5",
    "name": "Spatula",
    "price": 1.0,
    "weight": 80
  },
  {
    "id": "ab9c7417-8152-4105-94d5-1b4fd6e360ff",
    "name": "Egg Whisk",
    "price": 3.99,
    "weight": 150
  }
]